{
  "id": "pyright",
  "name": "Pyright (Python Language Server)",
  "check": {
    "fileExists": {
      "name": "Check if Pyright is installed",
      "file": "$SERVER_HOME$/node_modules/.bin/pyright-langserver*"
    }
  },
  "run": {
    "exec": {
      "name": "Install Pyright",
      "workingDir": "$SERVER_HOME$/node_modules",
      "command": {
        "windows": "npm.cmd install pyright --force",
        "default": "npm install pyright --force"
      },
      "onSuccess": {
        "configureServer": {
          "name": "Configure Pyright command",
          "command": {
            "windows": "$SERVER_HOME$/node_modules/.bin/pyright-langserver.cmd --stdio",
            "default": "$SERVER_HOME$/node_modules/.bin/pyright-langserver --stdio"
          }
        }
      }
    }
  }
}
