{
  "id": "lemminx",
  "name": "LemMinX (XML Language Server)",
  "check": {
    "fileExists": {
      "name": "Check if LemMinX is installed",
      "file": "$SERVER_HOME$/lemminx.jar"
    }
  },
  "run": {
    "download": {
      "name": "Download LemMinX",
      "url": "https://download.eclipse.org/lemminx/releases/0.26.1/org.eclipse.lemminx-uber.jar",
      "output": {
        "dir": "$SERVER_HOME$",
        "file": {
          "name": "lemminx.jar",
          "executable": true
        }
      },
      "onSuccess": {
        "configureServer": {
          "name": "Configure LemMinX server command",
          "command": "java -cp \"${output.dir}/${output.file.name}\" org.eclipse.lemminx.XMLServerLauncher",
          "update": true
        }
      }
    }
  }
}
